{
  "$schema": "http://json-schema.org/draft-07/schema#",
  "type": "array",
  "items": {
    "type": "object",
    "properties": {
      "code": {
        "type": "string"
      },
      "name": {
        "type": "string"
      },
      "text": {
        "type": "string"
      },
      "tags": {
        "type": "array",
        "items": {
          "$ref": "../schema.tags.json"
        }
      }
    },
    "required": ["code", "name", "text", "tags"]
  }
}
